00:36:04.448306 4c:bb:58:13:d4:60 > 33:33:00:00:00:16, ethertype IPv6 (0x86dd), length 150: fe80::c048:1977:4418:8cfe > ff02::16: HBH ICMP6, multicast listener report v2, 4 group record(s), length 88
00:36:04.714139 4c:bb:58:13:d4:60 > 4c:93:a6:8a:e2:9b, ethertype IPv4 (0x0800), length 105: 192.168.29.215.55560 > 67.199.150.85.443: Flags [P.], seq 3733957170:3733957209, ack 2707426726, win 501, options [nop,nop,TS val 3861083066 ecr 1784959040], length 39
00:36:04.791650 4c:93:a6:8a:e2:9b > 4c:bb:58:13:d4:60, ethertype IPv4 (0x0800), length 66: 67.199.150.85.443 > 192.168.29.215.55560: Flags [.], ack 39, win 4080, options [nop,nop,TS val 1785017425 ecr 3861083066], length 0
00:36:04.791907 4c:93:a6:8a:e2:9b > 4c:bb:58:13:d4:60, ethertype IPv4 (0x0800), length 105: 67.199.150.85.443 > 192.168.29.215.55560: Flags [P.], seq 1:40, ack 39, win 4080, options [nop,nop,TS val 1785017425 ecr 3861083066], length 39
00:36:04.791923 4c:bb:58:13:d4:60 > 4c:93:a6:8a:e2:9b, ethertype IPv4 (0x0800), length 66: 192.168.29.215.55560 > 67.199.150.85.443: Flags [.], ack 40, win 501, options [nop,nop,TS val 3861083144 ecr 1785017425], length 0
00:36:05.469561 4c:93:a6:8a:e2:9b > ff:ff:ff:ff:ff:ff, ethertype ARP (0x0806), length 42: Request who-has 192.168.29.136 (ff:ff:ff:ff:ff:ff) tell 192.168.29.1, length 28
00:36:06.866066 4c:bb:58:13:d4:60 > 4c:93:a6:8a:e2:9b, ethertype IPv6 (0x86dd), length 105: 2405:201:6005:9e3:bddc:e429:ec6b:f256.49534 > 2405:201:6005:9e3::c0a8:1d01.53: 33160+ A? f4n3x6c5.stackpathcdn.com. (43)
00:36:06.866237 4c:bb:58:13:d4:60 > 4c:93:a6:8a:e2:9b, ethertype IPv6 (0x86dd), length 105: 2405:201:6005:9e3:bddc:e429:ec6b:f256.33561 > 2405:201:6005:9e3::c0a8:1d01.53: 61802+ AAAA? f4n3x6c5.stackpathcdn.com. (43)
00:36:06.866588 4c:bb:58:13:d4:60 > 4c:93:a6:8a:e2:9b, ethertype IPv6 (0x86dd), length 100: 2405:201:6005:9e3:bddc:e429:ec6b:f256.58855 > 2405:201:6005:9e3::c0a8:1d01.53: 65435+ A? fonts.googleapis.com. (38)
00:36:06.866721 4c:bb:58:13:d4:60 > 4c:93:a6:8a:e2:9b, ethertype IPv6 (0x86dd), length 100: 2405:201:6005:9e3:bddc:e429:ec6b:f256.54054 > 2405:201:6005:9e3::c0a8:1d01.53: 8676+ AAAA? fonts.googleapis.com. (38)
00:36:06.867059 4c:bb:58:13:d4:60 > 4c:93:a6:8a:e2:9b, ethertype IPv6 (0x86dd), length 101: 2405:201:6005:9e3:bddc:e429:ec6b:f256.35895 > 2405:201:6005:9e3::c0a8:1d01.53: 32839+ A? www.c-sharpcorner.com. (39)
00:36:06.867206 4c:bb:58:13:d4:60 > 4c:93:a6:8a:e2:9b, ethertype IPv6 (0x86dd), length 101: 2405:201:6005:9e3:bddc:e429:ec6b:f256.38119 > 2405:201:6005:9e3::c0a8:1d01.53: 52346+ AAAA? www.c-sharpcorner.com. (39)
00:36:06.876144 4c:93:a6:8a:e2:9b > 4c:bb:58:13:d4:60, ethertype IPv6 (0x86dd), length 128: 2405:201:6005:9e3::c0a8:1d01.53 > 2405:201:6005:9e3:bddc:e429:ec6b:f256.54054: 8676 1/0/0 AAAA 2404:6800:4002:81f::200a (66)
00:36:06.876555 4c:93:a6:8a:e2:9b > 4c:bb:58:13:d4:60, ethertype IPv6 (0x86dd), length 121: 2405:201:6005:9e3::c0a8:1d01.53 > 2405:201:6005:9e3:bddc:e429:ec6b:f256.49534: 33160 1/0/0 A 151.139.128.10 (59)
00:36:06.876882 4c:93:a6:8a:e2:9b > 4c:bb:58:13:d4:60, ethertype IPv6 (0x86dd), length 116: 2405:201:6005:9e3::c0a8:1d01.53 > 2405:201:6005:9e3:bddc:e429:ec6b:f256.58855: 65435 1/0/0 A 142.250.194.42 (54)
00:36:06.877180 4c:93:a6:8a:e2:9b > 4c:bb:58:13:d4:60, ethertype IPv6 (0x86dd), length 117: 2405:201:6005:9e3::c0a8:1d01.53 > 2405:201:6005:9e3:bddc:e429:ec6b:f256.35895: 32839 1/0/0 A 40.65.205.118 (55)
00:36:06.877485 4c:93:a6:8a:e2:9b > 4c:bb:58:13:d4:60, ethertype IPv6 (0x86dd), length 184: 2405:201:6005:9e3::c0a8:1d01.53 > 2405:201:6005:9e3:bddc:e429:ec6b:f256.38119: 52346 0/1/0 (122)
00:36:06.877777 4c:93:a6:8a:e2:9b > 4c:bb:58:13:d4:60, ethertype IPv6 (0x86dd), length 183: 2405:201:6005:9e3::c0a8:1d01.53 > 2405:201:6005:9e3:bddc:e429:ec6b:f256.33561: 61802 0/1/0 (121)
00:36:06.878585 4c:bb:58:13:d4:60 > 4c:93:a6:8a:e2:9b, ethertype IPv6 (0x86dd), length 91: 2405:201:6005:9e3:bddc:e429:ec6b:f256.33652 > 2405:201:6005:9e3::c0a8:1d01.53: 8607+ A? g.ezodn.com. (29)
00:36:06.878759 4c:bb:58:13:d4:60 > 4c:93:a6:8a:e2:9b, ethertype IPv6 (0x86dd), length 92: 2405:201:6005:9e3:bddc:e429:ec6b:f256.51707 > 2405:201:6005:9e3::c0a8:1d01.53: 1703+ A? go.ezodn.com. (30)
00:36:06.878893 4c:bb:58:13:d4:60 > 4c:93:a6:8a:e2:9b, ethertype IPv6 (0x86dd), length 92: 2405:201:6005:9e3:bddc:e429:ec6b:f256.46454 > 2405:201:6005:9e3::c0a8:1d01.53: 3587+ AAAA? go.ezodn.com. (30)
00:36:06.879526 4c:bb:58:13:d4:60 > 4c:93:a6:8a:e2:9b, ethertype IPv6 (0x86dd), length 102: 2405:201:6005:9e3:bddc:e429:ec6b:f256.34546 > 2405:201:6005:9e3::c0a8:1d01.53: 21705+ A? e6603.g.akamaiedge.net. (40)
00:36:06.880552 4c:bb:58:13:d4:60 > 4c:93:a6:8a:e2:9b, ethertype IPv6 (0x86dd), length 102: 2405:201:6005:9e3:bddc:e429:ec6b:f256.34649 > 2405:201:6005:9e3::c0a8:1d01.53: 50717+ AAAA? e6603.g.akamaiedge.net. (40)
00:36:06.880765 4c:bb:58:13:d4:60 > 4c:93:a6:8a:e2:9b, ethertype IPv6 (0x86dd), length 91: 2405:201:6005:9e3:bddc:e429:ec6b:f256.58944 > 2405:201:6005:9e3::c0a8:1d01.53: 16862+ AAAA? g.ezodn.com. (29)
00:36:06.881225 4c:bb:58:13:d4:60 > 4c:93:a6:8a:e2:9b, ethertype IPv4 (0x0800), length 74: 192.168.29.215.60134 > 40.65.205.118.443: Flags [S], seq 4174034004, win 64240, options [mss 1460,sackOK,TS val 196267835 ecr 0,nop,wscale 7], length 0
00:36:06.882971 4c:93:a6:8a:e2:9b > 4c:bb:58:13:d4:60, ethertype IPv6 (0x86dd), length 102: 2405:201:6005:9e3::c0a8:1d01.53 > 2405:201:6005:9e3:bddc:e429:ec6b:f256.34649: 50717 0/0/0 (40)
00:36:06.885588 4c:93:a6:8a:e2:9b > 4c:bb:58:13:d4:60, ethertype IPv6 (0x86dd), length 123: 2405:201:6005:9e3::c0a8:1d01.53 > 2405:201:6005:9e3:bddc:e429:ec6b:f256.33652: 8607 2/0/0 A 172.64.96.19, A 172.64.97.19 (61)
00:36:06.886010 4c:93:a6:8a:e2:9b > 4c:bb:58:13:d4:60, ethertype IPv6 (0x86dd), length 124: 2405:201:6005:9e3::c0a8:1d01.53 > 2405:201:6005:9e3:bddc:e429:ec6b:f256.51707: 1703 2/0/0 A 172.64.97.19, A 172.64.96.19 (62)
00:36:06.886369 4c:93:a6:8a:e2:9b > 4c:bb:58:13:d4:60, ethertype IPv6 (0x86dd), length 148: 2405:201:6005:9e3::c0a8:1d01.53 > 2405:201:6005:9e3:bddc:e429:ec6b:f256.46454: 3587 2/0/0 AAAA 2606:4700:e0::ac40:6013, AAAA 2606:4700:e0::ac40:6113 (86)
00:36:06.886600 4c:93:a6:8a:e2:9b > 4c:bb:58:13:d4:60, ethertype IPv6 (0x86dd), length 118: 2405:201:6005:9e3::c0a8:1d01.53 > 2405:201:6005:9e3:bddc:e429:ec6b:f256.34546: 21705 1/0/0 A 23.210.68.244 (56)
00:36:06.887916 4c:bb:58:13:d4:60 > 4c:93:a6:8a:e2:9b, ethertype IPv6 (0x86dd), length 92: 2405:201:6005:9e3:bddc:e429:ec6b:f256.51665 > 2405:201:6005:9e3::c0a8:1d01.53: 50964+ A? btloader.com. (30)
00:36:06.888066 4c:bb:58:13:d4:60 > 4c:93:a6:8a:e2:9b, ethertype IPv6 (0x86dd), length 92: 2405:201:6005:9e3:bddc:e429:ec6b:f256.43002 > 2405:201:6005:9e3::c0a8:1d01.53: 32550+ AAAA? btloader.com. (30)
00:36:06.888221 4c:bb:58:13:d4:60 > 4c:93:a6:8a:e2:9b, ethertype IPv6 (0x86dd), length 101: 2405:201:6005:9e3:bddc:e429:ec6b:f256.54086 > 2405:201:6005:9e3::c0a8:1d01.53: 42250+ A? c.amazon-adsystem.com. (39)
00:36:06.888355 4c:bb:58:13:d4:60 > 4c:93:a6:8a:e2:9b, ethertype IPv6 (0x86dd), length 101: 2405:201:6005:9e3:bddc:e429:ec6b:f256.47622 > 2405:201:6005:9e3::c0a8:1d01.53: 49428+ AAAA? c.amazon-adsystem.com. (39)
00:36:06.888687 4c:bb:58:13:d4:60 > 4c:93:a6:8a:e2:9b, ethertype IPv6 (0x86dd), length 354: 2405:201:6005:9e3:bddc:e429:ec6b:f256.35564 > 2406:da1a:e10:3f:b8e4:8774:d92c:c074.443: Flags [P.], seq 3286902957:3286903225, ack 2791475175, win 501, options [nop,nop,TS val 1001136068 ecr 746690113], length 268
00:36:06.889068 4c:bb:58:13:d4:60 > 4c:93:a6:8a:e2:9b, ethertype IPv6 (0x86dd), length 117: 2405:201:6005:9e3:bddc:e429:ec6b:f256.35564 > 2406:da1a:e10:3f:b8e4:8774:d92c:c074.443: Flags [P.], seq 268:299, ack 1, win 501, options [nop,nop,TS val 1001136068 ecr 746690113], length 31
00:36:06.890607 4c:93:a6:8a:e2:9b > 4c:bb:58:13:d4:60, ethertype IPv6 (0x86dd), length 147: 2405:201:6005:9e3::c0a8:1d01.53 > 2405:201:6005:9e3:bddc:e429:ec6b:f256.58944: 16862 2/0/0 AAAA 2606:4700:e0::ac40:6113, AAAA 2606:4700:e0::ac40:6013 (85)
00:36:06.891598 4c:bb:58:13:d4:60 > 4c:93:a6:8a:e2:9b, ethertype IPv6 (0x86dd), length 96: 2405:201:6005:9e3:bddc:e429:ec6b:f256.47478 > 2405:201:6005:9e3::c0a8:1d01.53: 7092+ A? cdn.hadronid.net. (34)
00:36:06.891784 4c:bb:58:13:d4:60 > 4c:93:a6:8a:e2:9b, ethertype IPv6 (0x86dd), length 96: 2405:201:6005:9e3:bddc:e429:ec6b:f256.39466 > 2405:201:6005:9e3::c0a8:1d01.53: 27244+ AAAA? cdn.hadronid.net. (34)
00:36:06.897446 4c:93:a6:8a:e2:9b > 4c:bb:58:13:d4:60, ethertype IPv6 (0x86dd), length 124: 2405:201:6005:9e3::c0a8:1d01.53 > 2405:201:6005:9e3:bddc:e429:ec6b:f256.39466: 27244 1/0/0 AAAA 2606:4700:90c7:ea06:b164:26:5d50:42b0 (62)
00:36:06.897912 4c:93:a6:8a:e2:9b > 4c:bb:58:13:d4:60, ethertype IPv6 (0x86dd), length 140: 2405:201:6005:9e3::c0a8:1d01.53 > 2405:201:6005:9e3:bddc:e429:ec6b:f256.51665: 50964 3/0/0 A 104.26.7.139, A 104.26.6.139, A 172.67.70.134 (78)
00:36:06.898460 4c:93:a6:8a:e2:9b > 4c:bb:58:13:d4:60, ethertype IPv6 (0x86dd), length 160: 2405:201:6005:9e3::c0a8:1d01.53 > 2405:201:6005:9e3:bddc:e429:ec6b:f256.54086: 42250 2/0/0 CNAME d1ykf07e75w7ss.cloudfront.net., A 54.192.153.239 (98)
00:36:06.898744 4c:93:a6:8a:e2:9b > 4c:bb:58:13:d4:60, ethertype IPv6 (0x86dd), length 120: 2405:201:6005:9e3::c0a8:1d01.53 > 2405:201:6005:9e3:bddc:e429:ec6b:f256.43002: 32550 1/0/0 AAAA 2606:4700:90cb:ae8c:9664:26:2049:a24d (58)
00:36:06.898997 4c:93:a6:8a:e2:9b > 4c:bb:58:13:d4:60, ethertype IPv6 (0x86dd), length 144: 2405:201:6005:9e3::c0a8:1d01.53 > 2405:201:6005:9e3:bddc:e429:ec6b:f256.47478: 7092 3/0/0 A 104.22.53.173, A 104.22.52.173, A 172.67.36.110 (82)
00:36:06.899455 4c:bb:58:13:d4:60 > 4c:93:a6:8a:e2:9b, ethertype IPv6 (0x86dd), length 96: 2405:201:6005:9e3:bddc:e429:ec6b:f256.48766 > 2405:201:6005:9e3::c0a8:1d01.53: 54488+ A? cdn.id5-sync.com. (34)
00:36:06.899609 4c:bb:58:13:d4:60 > 4c:93:a6:8a:e2:9b, ethertype IPv6 (0x86dd), length 96: 2405:201:6005:9e3:bddc:e429:ec6b:f256.34435 > 2405:201:6005:9e3::c0a8:1d01.53: 20788+ AAAA? cdn.id5-sync.com. (34)
00:36:06.899744 4c:bb:58:13:d4:60 > 4c:93:a6:8a:e2:9b, ethertype IPv6 (0x86dd), length 104: 2405:201:6005:9e3:bddc:e429:ec6b:f256.40803 > 2405:201:6005:9e3::c0a8:1d01.53: 24997+ A? secure.cdn.fastclick.net. (42)
00:36:06.899874 4c:bb:58:13:d4:60 > 4c:93:a6:8a:e2:9b, ethertype IPv6 (0x86dd), length 104: 2405:201:6005:9e3:bddc:e429:ec6b:f256.39956 > 2405:201:6005:9e3::c0a8:1d01.53: 47226+ AAAA? secure.cdn.fastclick.net. (42)
00:36:06.902723 4c:93:a6:8a:e2:9b > 4c:bb:58:13:d4:60, ethertype IPv6 (0x86dd), length 222: 2405:201:6005:9e3::c0a8:1d01.53 > 2405:201:6005:9e3:bddc:e429:ec6b:f256.47622: 49428 1/1/0 CNAME d1ykf07e75w7ss.cloudfront.net. (160)
00:36:06.903160 4c:bb:58:13:d4:60 > 4c:93:a6:8a:e2:9b, ethertype IPv6 (0x86dd), length 109: 2405:201:6005:9e3:bddc:e429:ec6b:f256.45155 > 2405:201:6005:9e3::c0a8:1d01.53: 8116+ AAAA? d1ykf07e75w7ss.cloudfront.net. (47)
00:36:06.904594 4c:93:a6:8a:e2:9b > 4c:bb:58:13:d4:60, ethertype IPv6 (0x86dd), length 109: 2405:201:6005:9e3::c0a8:1d01.53 > 2405:201:6005:9e3:bddc:e429:ec6b:f256.45155: 8116 0/0/0 (47)
00:36:06.905966 4c:bb:58:13:d4:60 > 4c:93:a6:8a:e2:9b, ethertype IPv6 (0x86dd), length 95: 2405:201:6005:9e3:bddc:e429:ec6b:f256.56302 > 2405:201:6005:9e3::c0a8:1d01.53: 50876+ A? ad-delivery.net. (33)
00:36:06.906178 4c:bb:58:13:d4:60 > 4c:93:a6:8a:e2:9b, ethertype IPv6 (0x86dd), length 95: 2405:201:6005:9e3:bddc:e429:ec6b:f256.35679 > 2405:201:6005:9e3::c0a8:1d01.53: 17232+ AAAA? ad-delivery.net. (33)
00:36:06.915658 4c:93:a6:8a:e2:9b > 4c:bb:58:13:d4:60, ethertype IPv6 (0x86dd), length 144: 2405:201:6005:9e3::c0a8:1d01.53 > 2405:201:6005:9e3:bddc:e429:ec6b:f256.48766: 54488 3/0/0 A 104.22.53.86, A 172.67.38.106, A 104.22.52.86 (82)
00:36:06.916096 4c:93:a6:8a:e2:9b > 4c:bb:58:13:d4:60, ethertype IPv6 (0x86dd), length 124: 2405:201:6005:9e3::c0a8:1d01.53 > 2405:201:6005:9e3:bddc:e429:ec6b:f256.34435: 20788 1/0/0 AAAA 2606:4700:90c6:7a30:a00c:33:b9db:b91f (62)
00:36:06.916941 4c:93:a6:8a:e2:9b > 4c:bb:58:13:d4:60, ethertype IPv6 (0x86dd), length 201: 2405:201:6005:9e3::c0a8:1d01.53 > 2405:201:6005:9e3:bddc:e429:ec6b:f256.40803: 24997 3/0/0 CNAME secure2.cdn.fastclick.net.edgekey.net., CNAME e4536.g.akamaiedge.net., A 104.85.114.214 (139)
00:36:06.917132 4c:bb:58:13:d4:60 > 4c:93:a6:8a:e2:9b, ethertype IPv6 (0x86dd), length 96: 2405:201:6005:9e3:bddc:e429:ec6b:f256.53120 > 2405:201:6005:9e3::c0a8:1d01.53: 37365+ A? cds.connatix.com. (34)
00:36:06.917372 4c:93:a6:8a:e2:9b > 4c:bb:58:13:d4:60, ethertype IPv6 (0x86dd), length 246: 2405:201:6005:9e3::c0a8:1d01.53 > 2405:201:6005:9e3:bddc:e429:ec6b:f256.39956: 47226 2/1/0 CNAME secure2.cdn.fastclick.net.edgekey.net., CNAME e4536.g.akamaiedge.net. (184)
00:36:06.917874 4c:bb:58:13:d4:60 > 4c:93:a6:8a:e2:9b, ethertype IPv6 (0x86dd), length 102: 2405:201:6005:9e3:bddc:e429:ec6b:f256.42465 > 2405:201:6005:9e3::c0a8:1d01.53: 52696+ AAAA? e4536.g.akamaiedge.net. (40)
00:36:06.919008 4c:bb:58:13:d4:60 > 4c:93:a6:8a:e2:9b, ethertype IPv6 (0x86dd), length 96: 2405:201:6005:9e3:bddc:e429:ec6b:f256.51844 > 2405:201:6005:9e3::c0a8:1d01.53: 22815+ AAAA? cds.connatix.com. (34)
00:36:06.919647 4c:93:a6:8a:e2:9b > 4c:bb:58:13:d4:60, ethertype IPv6 (0x86dd), length 102: 2405:201:6005:9e3::c0a8:1d01.53 > 2405:201:6005:9e3:bddc:e429:ec6b:f256.42465: 52696 0/0/0 (40)
00:36:06.920780 4c:bb:58:13:d4:60 > 4c:93:a6:8a:e2:9b, ethertype IPv6 (0x86dd), length 113: 2405:201:6005:9e3:bddc:e429:ec6b:f256.50998 > 2405:201:6005:9e3::c0a8:1d01.53: 11871+ A? fundingchoicesmessages.google.com. (51)
00:36:06.921136 4c:bb:58:13:d4:60 > 4c:93:a6:8a:e2:9b, ethertype IPv6 (0x86dd), length 113: 2405:201:6005:9e3:bddc:e429:ec6b:f256.52120 > 2405:201:6005:9e3::c0a8:1d01.53: 49317+ AAAA? fundingchoicesmessages.google.com. (51)
00:36:06.922607 4c:93:a6:8a:e2:9b > 4c:bb:58:13:d4:60, ethertype IPv6 (0x86dd), length 123: 2405:201:6005:9e3::c0a8:1d01.53 > 2405:201:6005:9e3:bddc:e429:ec6b:f256.35679: 17232 1/0/0 AAAA 2606:4700:90c8:b60e:c964:26:2242:5bfe (61)
00:36:06.925706 4c:93:a6:8a:e2:9b > 4c:bb:58:13:d4:60, ethertype IPv6 (0x86dd), length 200: 2405:201:6005:9e3::c0a8:1d01.53 > 2405:201:6005:9e3:bddc:e429:ec6b:f256.51844: 22815 1/1/0 CNAME cds.connatix.com.cdn.cloudflare.net. (138)
00:36:06.926167 4c:93:a6:8a:e2:9b > 4c:bb:58:13:d4:60, ethertype IPv6 (0x86dd), length 86: 2406:da1a:e10:3f:b8e4:8774:d92c:c074.443 > 2405:201:6005:9e3:bddc:e429:ec6b:f256.35564: Flags [.], ack 299, win 502, options [nop,nop,TS val 746702559 ecr 1001136068], length 0
00:36:06.926316 4c:bb:58:13:d4:60 > 4c:93:a6:8a:e2:9b, ethertype IPv6 (0x86dd), length 115: 2405:201:6005:9e3:bddc:e429:ec6b:f256.41037 > 2405:201:6005:9e3::c0a8:1d01.53: 63453+ AAAA? cds.connatix.com.cdn.cloudflare.net. (53)
00:36:06.926700 4c:93:a6:8a:e2:9b > 4c:bb:58:13:d4:60, ethertype IPv6 (0x86dd), length 170: 2406:da1a:e10:3f:b8e4:8774:d92c:c074.443 > 2405:201:6005:9e3:bddc:e429:ec6b:f256.35564: Flags [P.], seq 1:85, ack 299, win 502, options [nop,nop,TS val 746702559 ecr 1001136068], length 84
00:36:06.926716 4c:bb:58:13:d4:60 > 4c:93:a6:8a:e2:9b, ethertype IPv6 (0x86dd), length 86: 2405:201:6005:9e3:bddc:e429:ec6b:f256.35564 > 2406:da1a:e10:3f:b8e4:8774:d92c:c074.443: Flags [.], ack 85, win 501, options [nop,nop,TS val 1001136106 ecr 746702559], length 0
00:36:06.927032 4c:93:a6:8a:e2:9b > 4c:bb:58:13:d4:60, ethertype IPv6 (0x86dd), length 143: 2405:201:6005:9e3::c0a8:1d01.53 > 2405:201:6005:9e3:bddc:e429:ec6b:f256.56302: 50876 3/0/0 A 172.67.69.19, A 104.26.2.70, A 104.26.3.70 (81)
00:36:06.927853 4c:bb:58:13:d4:60 > 4c:93:a6:8a:e2:9b, ethertype IPv6 (0x86dd), length 89: 2405:201:6005:9e3:bddc:e429:ec6b:f256.56036 > 2405:201:6005:9e3::c0a8:1d01.53: 4464+ A? ids.ad.gt. (27)
00:36:06.928062 4c:bb:58:13:d4:60 > 4c:93:a6:8a:e2:9b, ethertype IPv6 (0x86dd), length 89: 2405:201:6005:9e3:bddc:e429:ec6b:f256.56258 > 2405:201:6005:9e3::c0a8:1d01.53: 32032+ AAAA? ids.ad.gt. (27)
00:36:06.928900 4c:93:a6:8a:e2:9b > 4c:bb:58:13:d4:60, ethertype IPv6 (0x86dd), length 177: 2405:201:6005:9e3::c0a8:1d01.53 > 2405:201:6005:9e3:bddc:e429:ec6b:f256.53120: 37365 3/0/0 CNAME cds.connatix.com.cdn.cloudflare.net., A 104.18.33.52, A 172.64.154.204 (115)
00:36:06.929526 4c:93:a6:8a:e2:9b > 4c:bb:58:13:d4:60, ethertype IPv6 (0x86dd), length 150: 2405:201:6005:9e3::c0a8:1d01.53 > 2405:201:6005:9e3:bddc:e429:ec6b:f256.50998: 11871 2/0/0 CNAME www3.l.google.com., A 172.217.160.238 (88)
00:36:06.929764 4c:93:a6:8a:e2:9b > 4c:bb:58:13:d4:60, ethertype IPv6 (0x86dd), length 162: 2405:201:6005:9e3::c0a8:1d01.53 > 2405:201:6005:9e3:bddc:e429:ec6b:f256.52120: 49317 2/0/0 CNAME www3.l.google.com., AAAA 2404:6800:4002:804::200e (100)
00:36:06.929957 4c:93:a6:8a:e2:9b > 4c:bb:58:13:d4:60, ethertype IPv6 (0x86dd), length 115: 2405:201:6005:9e3::c0a8:1d01.53 > 2405:201:6005:9e3:bddc:e429:ec6b:f256.41037: 63453 0/0/0 (53)
00:36:06.931790 4c:bb:58:13:d4:60 > 4c:93:a6:8a:e2:9b, ethertype IPv6 (0x86dd), length 98: 2405:201:6005:9e3:bddc:e429:ec6b:f256.45135 > 2405:201:6005:9e3::c0a8:1d01.53: 21000+ A? cdn.ampproject.org. (36)
00:36:06.932334 4c:bb:58:13:d4:60 > 4c:93:a6:8a:e2:9b, ethertype IPv6 (0x86dd), length 98: 2405:201:6005:9e3:bddc:e429:ec6b:f256.35331 > 2405:201:6005:9e3::c0a8:1d01.53: 37124+ AAAA? cdn.ampproject.org. (36)
00:36:06.933391 4c:bb:58:13:d4:60 > 4c:93:a6:8a:e2:9b, ethertype IPv6 (0x86dd), length 97: 2405:201:6005:9e3:bddc:e429:ec6b:f256.41121 > 2405:201:6005:9e3::c0a8:1d01.53: 59455+ A? fonts.gstatic.com. (35)
00:36:06.933695 4c:bb:58:13:d4:60 > 4c:93:a6:8a:e2:9b, ethertype IPv6 (0x86dd), length 97: 2405:201:6005:9e3:bddc:e429:ec6b:f256.59207 > 2405:201:6005:9e3::c0a8:1d01.53: 46140+ AAAA? fonts.gstatic.com. (35)
00:36:06.945648 4c:93:a6:8a:e2:9b > 4c:bb:58:13:d4:60, ethertype IPv6 (0x86dd), length 179: 2405:201:6005:9e3::c0a8:1d01.53 > 2405:201:6005:9e3:bddc:e429:ec6b:f256.56036: 4464 4/0/0 CNAME ids.ad.gt.cdn.cloudflare.net., A 172.67.23.234, A 104.22.5.69, A 104.22.4.69 (117)
00:36:06.945886 4c:93:a6:8a:e2:9b > 4c:bb:58:13:d4:60, ethertype IPv6 (0x86dd), length 159: 2405:201:6005:9e3::c0a8:1d01.53 > 2405:201:6005:9e3:bddc:e429:ec6b:f256.56258: 32032 2/0/0 CNAME ids.ad.gt.cdn.cloudflare.net., AAAA 2606:4700:90c4:a207:f464:26:1394:4ac4 (97)
00:36:06.946183 4c:93:a6:8a:e2:9b > 4c:bb:58:13:d4:60, ethertype IPv6 (0x86dd), length 140: 2405:201:6005:9e3::c0a8:1d01.53 > 2405:201:6005:9e3:bddc:e429:ec6b:f256.45135: 21000 2/0/0 CNAME cdn-content.ampproject.org., A 216.58.196.193 (78)
00:36:06.946441 4c:93:a6:8a:e2:9b > 4c:bb:58:13:d4:60, ethertype IPv6 (0x86dd), length 152: 2405:201:6005:9e3::c0a8:1d01.53 > 2405:201:6005:9e3:bddc:e429:ec6b:f256.35331: 37124 2/0/0 CNAME cdn-content.ampproject.org., AAAA 2404:6800:4002:805::2001 (90)
00:36:06.948362 4c:bb:58:13:d4:60 > 4c:93:a6:8a:e2:9b, ethertype IPv6 (0x86dd), length 94: 2405:201:6005:9e3:bddc:e429:ec6b:f256.44627 > 2405:201:6005:9e3::c0a8:1d01.53: 23135+ A? www.google.com. (32)
00:36:06.949180 4c:bb:58:13:d4:60 > 4c:93:a6:8a:e2:9b, ethertype IPv6 (0x86dd), length 104: 2405:201:6005:9e3:bddc:e429:ec6b:f256.57234 > 2405:201:6005:9e3::c0a8:1d01.53: 53306+ A? www.google-analytics.com. (42)
00:36:06.949494 4c:bb:58:13:d4:60 > 4c:93:a6:8a:e2:9b, ethertype IPv6 (0x86dd), length 104: 2405:201:6005:9e3:bddc:e429:ec6b:f256.56962 > 2405:201:6005:9e3::c0a8:1d01.53: 59734+ AAAA? www.google-analytics.com. (42)
00:36:06.950722 4c:93:a6:8a:e2:9b > 4c:bb:58:13:d4:60, ethertype IPv6 (0x86dd), length 113: 2405:201:6005:9e3::c0a8:1d01.53 > 2405:201:6005:9e3:bddc:e429:ec6b:f256.41121: 59455 1/0/0 A 142.250.194.99 (51)
00:36:06.952468 4c:93:a6:8a:e2:9b > 4c:bb:58:13:d4:60, ethertype IPv6 (0x86dd), length 125: 2405:201:6005:9e3::c0a8:1d01.53 > 2405:201:6005:9e3:bddc:e429:ec6b:f256.59207: 46140 1/0/0 AAAA 2404:6800:4002:821::2003 (63)
00:36:06.953601 4c:bb:58:13:d4:60 > 4c:93:a6:8a:e2:9b, ethertype IPv6 (0x86dd), length 94: 2405:201:6005:9e3:bddc:e429:ec6b:f256.41305 > 2405:201:6005:9e3::c0a8:1d01.53: 11721+ A? rtb.adpone.com. (32)
00:36:06.954311 4c:bb:58:13:d4:60 > 4c:93:a6:8a:e2:9b, ethertype IPv6 (0x86dd), length 94: 2405:201:6005:9e3:bddc:e429:ec6b:f256.54107 > 2405:201:6005:9e3::c0a8:1d01.53: 56334+ AAAA? rtb.adpone.com. (32)
00:36:06.965868 4c:93:a6:8a:e2:9b > 4c:bb:58:13:d4:60, ethertype IPv6 (0x86dd), length 110: 2405:201:6005:9e3::c0a8:1d01.53 > 2405:201:6005:9e3:bddc:e429:ec6b:f256.44627: 23135 1/0/0 A 142.250.194.4 (48)
00:36:06.965911 4c:93:a6:8a:e2:9b > 4c:bb:58:13:d4:60, ethertype IPv6 (0x86dd), length 120: 2405:201:6005:9e3::c0a8:1d01.53 > 2405:201:6005:9e3:bddc:e429:ec6b:f256.57234: 53306 1/0/0 A 142.250.207.206 (58)
00:36:06.966126 4c:93:a6:8a:e2:9b > 4c:bb:58:13:d4:60, ethertype IPv6 (0x86dd), length 132: 2405:201:6005:9e3::c0a8:1d01.53 > 2405:201:6005:9e3:bddc:e429:ec6b:f256.56962: 59734 1/0/0 AAAA 2404:6800:4002:82e::200e (70)
00:36:06.967279 4c:bb:58:13:d4:60 > 4c:93:a6:8a:e2:9b, ethertype IPv6 (0x86dd), length 90: 2405:201:6005:9e3:bddc:e429:ec6b:f256.53437 > 2405:201:6005:9e3::c0a8:1d01.53: 31226+ A? sopalk.com. (28)
00:36:06.968601 4c:bb:58:13:d4:60 > 4c:93:a6:8a:e2:9b, ethertype IPv6 (0x86dd), length 93: 2405:201:6005:9e3:bddc:e429:ec6b:f256.47878 > 2405:201:6005:9e3::c0a8:1d01.53: 26984+ AAAA? hb.adpone.com. (31)
00:36:06.973081 4c:93:a6:8a:e2:9b > 4c:bb:58:13:d4:60, ethertype IPv6 (0x86dd), length 122: 2405:201:6005:9e3::c0a8:1d01.53 > 2405:201:6005:9e3:bddc:e429:ec6b:f256.54107: 56334 1/0/0 AAAA 2606:4700:90c9:7c3e:370c:33:6e00:265 (60)
00:36:06.973347 4c:93:a6:8a:e2:9b > 4c:bb:58:13:d4:60, ethertype IPv6 (0x86dd), length 142: 2405:201:6005:9e3::c0a8:1d01.53 > 2405:201:6005:9e3:bddc:e429:ec6b:f256.41305: 11721 3/0/0 A 172.67.73.228, A 104.26.11.25, A 104.26.10.25 (80)
00:36:06.980787 4c:93:a6:8a:e2:9b > 4c:bb:58:13:d4:60, ethertype IPv6 (0x86dd), length 121: 2405:201:6005:9e3::c0a8:1d01.53 > 2405:201:6005:9e3:bddc:e429:ec6b:f256.47878: 26984 1/0/0 AAAA 2606:4700:90c9:7c3e:370c:33:6e00:265 (59)
00:36:06.981340 4c:93:a6:8a:e2:9b > 4c:bb:58:13:d4:60, ethertype IPv6 (0x86dd), length 154: 2405:201:6005:9e3::c0a8:1d01.53 > 2405:201:6005:9e3:bddc:e429:ec6b:f256.53437: 31226 4/0/0 A 18.164.237.62, A 18.164.237.60, A 18.164.237.118, A 18.164.237.59 (92)
00:36:07.118013 4c:93:a6:8a:e2:9b > 4c:bb:58:13:d4:60, ethertype IPv4 (0x0800), length 66: 40.65.205.118.443 > 192.168.29.215.60134: Flags [S.], seq 3604367401, ack 4174034005, win 65535, options [mss 1440,nop,wscale 8,nop,nop,sackOK], length 0
00:36:07.118062 4c:bb:58:13:d4:60 > 4c:93:a6:8a:e2:9b, ethertype IPv4 (0x0800), length 54: 192.168.29.215.60134 > 40.65.205.118.443: Flags [.], ack 1, win 502, length 0
00:36:07.124748 4c:bb:58:13:d4:60 > 4c:93:a6:8a:e2:9b, ethertype IPv4 (0x0800), length 571: 192.168.29.215.60134 > 40.65.205.118.443: Flags [P.], seq 1:518, ack 1, win 502, length 517
00:36:07.364102 4c:93:a6:8a:e2:9b > 4c:bb:58:13:d4:60, ethertype IPv4 (0x0800), length 1514: 40.65.205.118.443 > 192.168.29.215.60134: Flags [.], seq 1:1461, ack 518, win 1024, length 1460
00:36:07.364152 4c:bb:58:13:d4:60 > 4c:93:a6:8a:e2:9b, ethertype IPv4 (0x0800), length 54: 192.168.29.215.60134 > 40.65.205.118.443: Flags [.], ack 1461, win 501, length 0
00:36:07.364501 4c:93:a6:8a:e2:9b > 4c:bb:58:13:d4:60, ethertype IPv4 (0x0800), length 1514: 40.65.205.118.443 > 192.168.29.215.60134: Flags [.], seq 1461:2921, ack 518, win 1024, length 1460
00:36:07.364515 4c:bb:58:13:d4:60 > 4c:93:a6:8a:e2:9b, ethertype IPv4 (0x0800), length 54: 192.168.29.215.60134 > 40.65.205.118.443: Flags [.], ack 2921, win 501, length 0
00:36:07.364824 4c:93:a6:8a:e2:9b > 4c:bb:58:13:d4:60, ethertype IPv4 (0x0800), length 1047: 40.65.205.118.443 > 192.168.29.215.60134: Flags [P.], seq 2921:3914, ack 518, win 1024, length 993
00:36:07.364842 4c:bb:58:13:d4:60 > 4c:93:a6:8a:e2:9b, ethertype IPv4 (0x0800), length 54: 192.168.29.215.60134 > 40.65.205.118.443: Flags [.], ack 3914, win 501, length 0
00:36:07.384531 4c:bb:58:13:d4:60 > 4c:93:a6:8a:e2:9b, ethertype IPv4 (0x0800), length 212: 192.168.29.215.60134 > 40.65.205.118.443: Flags [P.], seq 518:676, ack 3914, win 501, length 158
00:36:07.517473 4c:93:a6:8a:e2:9b > ff:ff:ff:ff:ff:ff, ethertype ARP (0x0806), length 42: Request who-has 192.168.29.205 (ff:ff:ff:ff:ff:ff) tell 192.168.29.1, length 28
00:36:07.637754 4c:93:a6:8a:e2:9b > 4c:bb:58:13:d4:60, ethertype IPv4 (0x0800), length 105: 40.65.205.118.443 > 192.168.29.215.60134: Flags [P.], seq 3914:3965, ack 676, win 1023, length 51
00:36:07.637782 4c:bb:58:13:d4:60 > 4c:93:a6:8a:e2:9b, ethertype IPv4 (0x0800), length 54: 192.168.29.215.60134 > 40.65.205.118.443: Flags [.], ack 3965, win 501, length 0
00:36:07.638223 4c:93:a6:8a:e2:9b > 4c:bb:58:13:d4:60, ethertype IPv4 (0x0800), length 123: 40.65.205.118.443 > 192.168.29.215.60134: Flags [P.], seq 3965:4034, ack 676, win 1023, length 69
00:36:07.638236 4c:bb:58:13:d4:60 > 4c:93:a6:8a:e2:9b, ethertype IPv4 (0x0800), length 54: 192.168.29.215.60134 > 40.65.205.118.443: Flags [.], ack 4034, win 501, length 0
00:36:07.638798 4c:bb:58:13:d4:60 > 4c:93:a6:8a:e2:9b, ethertype IPv4 (0x0800), length 231: 192.168.29.215.60134 > 40.65.205.118.443: Flags [P.], seq 676:853, ack 4034, win 501, length 177
00:36:07.638895 4c:bb:58:13:d4:60 > 4c:93:a6:8a:e2:9b, ethertype IPv4 (0x0800), length 1494: 192.168.29.215.60134 > 40.65.205.118.443: Flags [.], seq 853:2293, ack 4034, win 501, length 1440
00:36:07.638902 4c:bb:58:13:d4:60 > 4c:93:a6:8a:e2:9b, ethertype IPv4 (0x0800), length 853: 192.168.29.215.60134 > 40.65.205.118.443: Flags [P.], seq 2293:3092, ack 4034, win 501, length 799
00:36:07.642734 4c:bb:58:13:d4:60 > 4c:93:a6:8a:e2:9b, ethertype IPv4 (0x0800), length 92: 192.168.29.215.60134 > 40.65.205.118.443: Flags [P.], seq 3092:3130, ack 4034, win 501, length 38
00:36:07.875294 4c:93:a6:8a:e2:9b > 4c:bb:58:13:d4:60, ethertype IPv4 (0x0800), length 54: 40.65.205.118.443 > 192.168.29.215.60134: Flags [.], ack 3092, win 1026, length 0
00:36:07.875738 4c:93:a6:8a:e2:9b > 4c:bb:58:13:d4:60, ethertype IPv4 (0x0800), length 92: 40.65.205.118.443 > 192.168.29.215.60134: Flags [P.], seq 4034:4072, ack 3092, win 1026, length 38
00:36:07.875762 4c:bb:58:13:d4:60 > 4c:93:a6:8a:e2:9b, ethertype IPv4 (0x0800), length 54: 192.168.29.215.60134 > 40.65.205.118.443: Flags [.], ack 4072, win 501, length 0
00:36:07.904244 4c:bb:58:13:d4:60 > 4c:93:a6:8a:e2:9b, ethertype IPv4 (0x0800), length 66: 192.168.29.215.58028 > 67.199.150.77.443: Flags [.], ack 2790148786, win 501, options [nop,nop,TS val 3996163698 ecr 1785010373], length 0
00:36:07.918346 4c:93:a6:8a:e2:9b > 4c:bb:58:13:d4:60, ethertype IPv4 (0x0800), length 54: 40.65.205.118.443 > 192.168.29.215.60134: Flags [.], ack 3130, win 1026, length 0
00:36:07.936132 4c:93:a6:8a:e2:9b > 4c:bb:58:13:d4:60, ethertype IPv4 (0x0800), length 1514: 40.65.205.118.443 > 192.168.29.215.60134: Flags [.], seq 4072:5532, ack 3130, win 1026, length 1460
00:36:07.936162 4c:bb:58:13:d4:60 > 4c:93:a6:8a:e2:9b, ethertype IPv4 (0x0800), length 54: 192.168.29.215.60134 > 40.65.205.118.443: Flags [.], ack 5532, win 501, length 0
00:36:07.936935 4c:93:a6:8a:e2:9b > 4c:bb:58:13:d4:60, ethertype IPv4 (0x0800), length 1514: 40.65.205.118.443 > 192.168.29.215.60134: Flags [.], seq 5532:6992, ack 3130, win 1026, length 1460
00:36:07.936958 4c:bb:58:13:d4:60 > 4c:93:a6:8a:e2:9b, ethertype IPv4 (0x0800), length 54: 192.168.29.215.60134 > 40.65.205.118.443: Flags [.], ack 6992, win 501, length 0
00:36:07.937003 4c:93:a6:8a:e2:9b > 4c:bb:58:13:d4:60, ethertype IPv4 (0x0800), length 1514: 40.65.205.118.443 > 192.168.29.215.60134: Flags [.], seq 6992:8452, ack 3130, win 1026, length 1460
00:36:07.937012 4c:bb:58:13:d4:60 > 4c:93:a6:8a:e2:9b, ethertype IPv4 (0x0800), length 54: 192.168.29.215.60134 > 40.65.205.118.443: Flags [.], ack 8452, win 492, length 0
00:36:07.937513 4c:93:a6:8a:e2:9b > 4c:bb:58:13:d4:60, ethertype IPv4 (0x0800), length 1514: 40.65.205.118.443 > 192.168.29.215.60134: Flags [.], seq 8452:9912, ack 3130, win 1026, length 1460
00:36:07.937534 4c:bb:58:13:d4:60 > 4c:93:a6:8a:e2:9b, ethertype IPv4 (0x0800), length 54: 192.168.29.215.60134 > 40.65.205.118.443: Flags [.], ack 9912, win 501, length 0
00:36:07.937571 4c:93:a6:8a:e2:9b > 4c:bb:58:13:d4:60, ethertype IPv4 (0x0800), length 1514: 40.65.205.118.443 > 192.168.29.215.60134: Flags [.], seq 9912:11372, ack 3130, win 1026, length 1460
00:36:07.937582 4c:bb:58:13:d4:60 > 4c:93:a6:8a:e2:9b, ethertype IPv4 (0x0800), length 54: 192.168.29.215.60134 > 40.65.205.118.443: Flags [.], ack 11372, win 492, length 0
00:36:07.939007 4c:93:a6:8a:e2:9b > 4c:bb:58:13:d4:60, ethertype IPv4 (0x0800), length 1514: 40.65.205.118.443 > 192.168.29.215.60134: Flags [.], seq 11372:12832, ack 3130, win 1026, length 1460
00:36:07.939035 4c:93:a6:8a:e2:9b > 4c:bb:58:13:d4:60, ethertype IPv4 (0x0800), length 1514: 40.65.205.118.443 > 192.168.29.215.60134: Flags [.], seq 12832:14292, ack 3130, win 1026, length 1460
00:36:07.939050 4c:bb:58:13:d4:60 > 4c:93:a6:8a:e2:9b, ethertype IPv4 (0x0800), length 54: 192.168.29.215.60134 > 40.65.205.118.443: Flags [.], ack 14292, win 492, length 0
00:36:07.939090 4c:93:a6:8a:e2:9b > 4c:bb:58:13:d4:60, ethertype IPv4 (0x0800), length 1514: 40.65.205.118.443 > 192.168.29.215.60134: Flags [.], seq 14292:15752, ack 3130, win 1026, length 1460
00:36:07.939101 4c:93:a6:8a:e2:9b > 4c:bb:58:13:d4:60, ethertype IPv4 (0x0800), length 1514: 40.65.205.118.443 > 192.168.29.215.60134: Flags [.], seq 15752:17212, ack 3130, win 1026, length 1460
00:36:07.939205 4c:bb:58:13:d4:60 > 4c:93:a6:8a:e2:9b, ethertype IPv4 (0x0800), length 54: 192.168.29.215.60134 > 40.65.205.118.443: Flags [.], ack 17212, win 501, length 0
00:36:07.940084 4c:93:a6:8a:e2:9b > 4c:bb:58:13:d4:60, ethertype IPv4 (0x0800), length 1514: 40.65.205.118.443 > 192.168.29.215.60134: Flags [.], seq 17212:18672, ack 3130, win 1026, length 1460
00:36:07.940111 4c:93:a6:8a:e2:9b > 4c:bb:58:13:d4:60, ethertype IPv4 (0x0800), length 1514: 40.65.205.118.443 > 192.168.29.215.60134: Flags [.], seq 18672:20132, ack 3130, win 1026, length 1460
00:36:07.940122 4c:93:a6:8a:e2:9b > 4c:bb:58:13:d4:60, ethertype IPv4 (0x0800), length 573: 40.65.205.118.443 > 192.168.29.215.60134: Flags [P.], seq 20132:20651, ack 3130, win 1026, length 519
00:36:07.940131 4c:93:a6:8a:e2:9b > 4c:bb:58:13:d4:60, ethertype IPv4 (0x0800), length 1514: 40.65.205.118.443 > 192.168.29.215.60134: Flags [.], seq 20651:22111, ack 3130, win 1026, length 1460
00:36:07.940233 4c:bb:58:13:d4:60 > 4c:93:a6:8a:e2:9b, ethertype IPv4 (0x0800), length 54: 192.168.29.215.60134 > 40.65.205.118.443: Flags [.], ack 22111, win 473, length 0
00:36:07.980795 4c:93:a6:8a:e2:9b > 4c:bb:58:13:d4:60, ethertype IPv4 (0x0800), length 66: 67.199.150.77.443 > 192.168.29.215.58028: Flags [.], ack 1, win 13476, options [nop,nop,TS val 1785020615 ecr 3996092071], length 0
00:36:08.172344 4c:93:a6:8a:e2:9b > 4c:bb:58:13:d4:60, ethertype IPv4 (0x0800), length 1514: 40.65.205.118.443 > 192.168.29.215.60134: Flags [.], seq 22111:23571, ack 3130, win 1026, length 1460
00:36:08.172752 4c:93:a6:8a:e2:9b > 4c:bb:58:13:d4:60, ethertype IPv4 (0x0800), length 1514: 40.65.205.118.443 > 192.168.29.215.60134: Flags [.], seq 23571:25031, ack 3130, win 1026, length 1460
00:36:08.172771 4c:bb:58:13:d4:60 > 4c:93:a6:8a:e2:9b, ethertype IPv4 (0x0800), length 54: 192.168.29.215.60134 > 40.65.205.118.443: Flags [.], ack 25031, win 501, length 0
00:36:08.174794 4c:93:a6:8a:e2:9b > 4c:bb:58:13:d4:60, ethertype IPv4 (0x0800), length 1514: 40.65.205.118.443 > 192.168.29.215.60134: Flags [.], seq 25031:26491, ack 3130, win 1026, length 1460
00:36:08.175206 4c:93:a6:8a:e2:9b > 4c:bb:58:13:d4:60, ethertype IPv4 (0x0800), length 1514: 40.65.205.118.443 > 192.168.29.215.60134: Flags [.], seq 26491:27951, ack 3130, win 1026, length 1460
00:36:08.175224 4c:bb:58:13:d4:60 > 4c:93:a6:8a:e2:9b, ethertype IPv4 (0x0800), length 54: 192.168.29.215.60134 > 40.65.205.118.443: Flags [.], ack 27951, win 501, length 0
00:36:08.175826 4c:93:a6:8a:e2:9b > 4c:bb:58:13:d4:60, ethertype IPv4 (0x0800), length 1514: 40.65.205.118.443 > 192.168.29.215.60134: Flags [.], seq 27951:29411, ack 3130, win 1026, length 1460
00:36:08.176466 4c:93:a6:8a:e2:9b > 4c:bb:58:13:d4:60, ethertype IPv4 (0x0800), length 1514: 40.65.205.118.443 > 192.168.29.215.60134: Flags [.], seq 29411:30871, ack 3130, win 1026, length 1460
00:36:08.176498 4c:bb:58:13:d4:60 > 4c:93:a6:8a:e2:9b, ethertype IPv4 (0x0800), length 54: 192.168.29.215.60134 > 40.65.205.118.443: Flags [.], ack 30871, win 501, length 0
00:36:08.176534 4c:93:a6:8a:e2:9b > 4c:bb:58:13:d4:60, ethertype IPv4 (0x0800), length 1514: 40.65.205.118.443 > 192.168.29.215.60134: Flags [.], seq 30871:32331, ack 3130, win 1026, length 1460
00:36:08.177244 4c:93:a6:8a:e2:9b > 4c:bb:58:13:d4:60, ethertype IPv4 (0x0800), length 1514: 40.65.205.118.443 > 192.168.29.215.60134: Flags [.], seq 32331:33791, ack 3130, win 1026, length 1460
00:36:08.177259 4c:bb:58:13:d4:60 > 4c:93:a6:8a:e2:9b, ethertype IPv4 (0x0800), length 54: 192.168.29.215.60134 > 40.65.205.118.443: Flags [.], ack 33791, win 501, length 0
00:36:08.177287 4c:93:a6:8a:e2:9b > 4c:bb:58:13:d4:60, ethertype IPv4 (0x0800), length 1514: 40.65.205.118.443 > 192.168.29.215.60134: Flags [.], seq 33791:35251, ack 3130, win 1026, length 1460
00:36:08.177944 4c:93:a6:8a:e2:9b > 4c:bb:58:13:d4:60, ethertype IPv4 (0x0800), length 1514: 40.65.205.118.443 > 192.168.29.215.60134: Flags [.], seq 35251:36711, ack 3130, win 1026, length 1460
00:36:08.177959 4c:bb:58:13:d4:60 > 4c:93:a6:8a:e2:9b, ethertype IPv4 (0x0800), length 54: 192.168.29.215.60134 > 40.65.205.118.443: Flags [.], ack 36711, win 501, length 0
00:36:08.177982 4c:93:a6:8a:e2:9b > 4c:bb:58:13:d4:60, ethertype IPv4 (0x0800), length 1514: 40.65.205.118.443 > 192.168.29.215.60134: Flags [.], seq 36711:38171, ack 3130, win 1026, length 1460
00:36:08.178517 4c:93:a6:8a:e2:9b > 4c:bb:58:13:d4:60, ethertype IPv4 (0x0800), length 1514: 40.65.205.118.443 > 192.168.29.215.60134: Flags [.], seq 38171:39631, ack 3130, win 1026, length 1460
00:36:08.178529 4c:93:a6:8a:e2:9b > 4c:bb:58:13:d4:60, ethertype IPv4 (0x0800), length 1514: 40.65.205.118.443 > 192.168.29.215.60134: Flags [.], seq 39631:41091, ack 3130, win 1026, length 1460
00:36:08.178576 4c:bb:58:13:d4:60 > 4c:93:a6:8a:e2:9b, ethertype IPv4 (0x0800), length 54: 192.168.29.215.60134 > 40.65.205.118.443: Flags [.], ack 41091, win 473, length 0
00:36:08.179453 4c:93:a6:8a:e2:9b > 4c:bb:58:13:d4:60, ethertype IPv4 (0x0800), length 1514: 40.65.205.118.443 > 192.168.29.215.60134: Flags [P.], seq 41091:42551, ack 3130, win 1026, length 1460
00:36:08.179467 4c:93:a6:8a:e2:9b > 4c:bb:58:13:d4:60, ethertype IPv4 (0x0800), length 1514: 40.65.205.118.443 > 192.168.29.215.60134: Flags [.], seq 42551:44011, ack 3130, win 1026, length 1460
00:36:08.179477 4c:bb:58:13:d4:60 > 4c:93:a6:8a:e2:9b, ethertype IPv4 (0x0800), length 54: 192.168.29.215.60134 > 40.65.205.118.443: Flags [.], ack 44011, win 492, length 0
00:36:08.179494 4c:93:a6:8a:e2:9b > 4c:bb:58:13:d4:60, ethertype IPv4 (0x0800), length 1514: 40.65.205.118.443 > 192.168.29.215.60134: Flags [.], seq 44011:45471, ack 3130, win 1026, length 1460
00:36:08.180683 4c:93:a6:8a:e2:9b > 4c:bb:58:13:d4:60, ethertype IPv4 (0x0800), length 1514: 40.65.205.118.443 > 192.168.29.215.60134: Flags [.], seq 45471:46931, ack 3130, win 1026, length 1460
00:36:08.180701 4c:bb:58:13:d4:60 > 4c:93:a6:8a:e2:9b, ethertype IPv4 (0x0800), length 54: 192.168.29.215.60134 > 40.65.205.118.443: Flags [.], ack 46931, win 501, length 0
00:36:08.180739 4c:93:a6:8a:e2:9b > 4c:bb:58:13:d4:60, ethertype IPv4 (0x0800), length 1514: 40.65.205.118.443 > 192.168.29.215.60134: Flags [.], seq 46931:48391, ack 3130, win 1026, length 1460
00:36:08.180748 4c:93:a6:8a:e2:9b > 4c:bb:58:13:d4:60, ethertype IPv4 (0x0800), length 1514: 40.65.205.118.443 > 192.168.29.215.60134: Flags [.], seq 48391:49851, ack 3130, win 1026, length 1460
00:36:08.180755 4c:93:a6:8a:e2:9b > 4c:bb:58:13:d4:60, ethertype IPv4 (0x0800), length 1514: 40.65.205.118.443 > 192.168.29.215.60134: Flags [.], seq 49851:51311, ack 3130, win 1026, length 1460
00:36:08.180850 4c:bb:58:13:d4:60 > 4c:93:a6:8a:e2:9b, ethertype IPv4 (0x0800), length 54: 192.168.29.215.60134 > 40.65.205.118.443: Flags [.], ack 51311, win 501, length 0
00:36:08.181809 4c:93:a6:8a:e2:9b > 4c:bb:58:13:d4:60, ethertype IPv4 (0x0800), length 1514: 40.65.205.118.443 > 192.168.29.215.60134: Flags [.], seq 51311:52771, ack 3130, win 1026, length 1460
00:36:08.181830 4c:93:a6:8a:e2:9b > 4c:bb:58:13:d4:60, ethertype IPv4 (0x0800), length 1514: 40.65.205.118.443 > 192.168.29.215.60134: Flags [.], seq 52771:54231, ack 3130, win 1026, length 1460
00:36:08.181843 4c:93:a6:8a:e2:9b > 4c:bb:58:13:d4:60, ethertype IPv4 (0x0800), length 1514: 40.65.205.118.443 > 192.168.29.215.60134: Flags [.], seq 54231:55691, ack 3130, win 1026, length 1460
00:36:08.181849 4c:93:a6:8a:e2:9b > 4c:bb:58:13:d4:60, ethertype IPv4 (0x0800), length 1514: 40.65.205.118.443 > 192.168.29.215.60134: Flags [.], seq 55691:57151, ack 3130, win 1026, length 1460
00:36:08.182193 4c:93:a6:8a:e2:9b > 4c:bb:58:13:d4:60, ethertype IPv4 (0x0800), length 1514: 40.65.205.118.443 > 192.168.29.215.60134: Flags [P.], seq 57151:58611, ack 3130, win 1026, length 1460
00:36:08.182774 4c:bb:58:13:d4:60 > 4c:93:a6:8a:e2:9b, ethertype IPv4 (0x0800), length 54: 192.168.29.215.60134 > 40.65.205.118.443: Flags [.], ack 58611, win 464, length 0
00:36:08.321675 4c:bb:58:13:d4:60 > 4c:93:a6:8a:e2:9b, ethertype IPv6 (0x86dd), length 100: 2405:201:6005:9e3:bddc:e429:ec6b:f256.45025 > 2405:201:6005:9e3::c0a8:1d01.53: 50668+ A? analytics.google.com. (38)
00:36:08.323458 4c:bb:58:13:d4:60 > 4c:93:a6:8a:e2:9b, ethertype IPv6 (0x86dd), length 100: 2405:201:6005:9e3:bddc:e429:ec6b:f256.47033 > 2405:201:6005:9e3::c0a8:1d01.53: 45570+ AAAA? analytics.google.com. (38)
00:36:08.329713 4c:93:a6:8a:e2:9b > 4c:bb:58:13:d4:60, ethertype IPv6 (0x86dd), length 192: 2405:201:6005:9e3::c0a8:1d01.53 > 2405:201:6005:9e3:bddc:e429:ec6b:f256.45025: 50668 5/0/0 CNAME analytics-alv.google.com., A 216.239.34.181, A 216.239.36.181, A 216.239.32.181, A 216.239.38.181 (130)
00:36:08.330975 4c:93:a6:8a:e2:9b > 4c:bb:58:13:d4:60, ethertype IPv6 (0x86dd), length 240: 2405:201:6005:9e3::c0a8:1d01.53 > 2405:201:6005:9e3:bddc:e429:ec6b:f256.47033: 45570 5/0/0 CNAME analytics-alv.google.com., AAAA 2001:4860:4802:32::181, AAAA 2001:4860:4802:36::181, AAAA 2001:4860:4802:34::181, AAAA 2001:4860:4802:38::181 (178)
00:36:08.332539 4c:bb:58:13:d4:60 > 4c:93:a6:8a:e2:9b, ethertype IPv6 (0x86dd), length 94: 2405:201:6005:9e3:bddc:e429:ec6b:f256.58386 > 2001:4860:4802:38::181.443: Flags [S], seq 1517569367, win 64800, options [mss 1440,sackOK,TS val 1742457434 ecr 0,nop,wscale 7], length 0
00:36:08.333900 4c:bb:58:13:d4:60 > 4c:93:a6:8a:e2:9b, ethertype IPv6 (0x86dd), length 96: 2405:201:6005:9e3:bddc:e429:ec6b:f256.38843 > 2405:201:6005:9e3::c0a8:1d01.53: 31596+ A? www.google.co.in. (34)
00:36:08.334060 4c:bb:58:13:d4:60 > 4c:93:a6:8a:e2:9b, ethertype IPv6 (0x86dd), length 96: 2405:201:6005:9e3:bddc:e429:ec6b:f256.43056 > 2405:201:6005:9e3::c0a8:1d01.53: 52201+ AAAA? www.google.co.in. (34)
00:36:08.343051 4c:93:a6:8a:e2:9b > 4c:bb:58:13:d4:60, ethertype IPv6 (0x86dd), length 124: 2405:201:6005:9e3::c0a8:1d01.53 > 2405:201:6005:9e3:bddc:e429:ec6b:f256.43056: 52201 1/0/0 AAAA 2404:6800:4002:823::2003 (62)
00:36:08.344075 4c:93:a6:8a:e2:9b > 4c:bb:58:13:d4:60, ethertype IPv6 (0x86dd), length 112: 2405:201:6005:9e3::c0a8:1d01.53 > 2405:201:6005:9e3:bddc:e429:ec6b:f256.38843: 31596 1/0/0 A 142.250.194.163 (50)
00:36:08.346624 4c:93:a6:8a:e2:9b > 4c:bb:58:13:d4:60, ethertype IPv6 (0x86dd), length 94: 2001:4860:4802:38::181.443 > 2405:201:6005:9e3:bddc:e429:ec6b:f256.58386: Flags [S.], seq 3613412024, ack 1517569368, win 65535, options [mss 1440,sackOK,TS val 2588506345 ecr 1742457434,nop,wscale 8], length 0
00:36:08.346663 4c:bb:58:13:d4:60 > 4c:93:a6:8a:e2:9b, ethertype IPv6 (0x86dd), length 86: 2405:201:6005:9e3:bddc:e429:ec6b:f256.58386 > 2001:4860:4802:38::181.443: Flags [.], ack 1, win 507, options [nop,nop,TS val 1742457448 ecr 2588506345], length 0
